{
  "catalog": "gantry.general-purpose-preregistration",
  "major": 1,
  "minor": 0,
  "specification_revision": "037eaac4a62a1dd6eaa00711536a75da3554548ec8fc232637b1a7d16134749e",
  "decision_record_template": [
    "compatibility-owner",
    "evidence-owner",
    "normative-owner",
    "publication-blocker",
    "rerun-set"
  ],
  "policy": {
    "supported_platforms": [
      "linux",
      "macos"
    ],
    "unsupported_platforms": [
      "windows"
    ],
    "provider_integration": "embedding-harness-mocked-hooks-only",
    "semantic_oracles": [
      "deterministic-fakes",
      "mocked-hooks",
      "recorded-transcripts"
    ],
    "agent_runs_per_task": 1,
    "human_trials": "deferred-until-after-implementation",
    "performance_gate": "functionality-first-no-obviously-suboptimal-design",
    "quantitative_performance_thresholds": "deferred"
  },
  "tasks": [
    {
      "id": "cancellation",
      "intent": "Stop active application and agent work without leaking ownership or publishing a second outcome.",
      "acceptance": "The agent identifies the stop boundary and produces a compile-and-test-correct change using only documented controls."
    },
    {
      "id": "create",
      "intent": "Create a complete package from a fixed behavioral brief.",
      "acceptance": "The package compiles, its tests pass, and all external operations and authority requirements are explicit."
    },
    {
      "id": "debug",
      "intent": "Diagnose and repair a seeded type, ownership, effect, or runtime failure.",
      "acceptance": "The repair passes the fixed regression and does not weaken authority, recovery, or resource limits."
    },
    {
      "id": "explain",
      "intent": "Explain the behavior and authority boundaries of a complete representative program.",
      "acceptance": "The explanation locates every external operation, suspension point, ownership transfer, and release boundary."
    },
    {
      "id": "modify",
      "intent": "Modify a representative program while preserving its fixed behavioral contract.",
      "acceptance": "The modified package compiles and passes old and new tests without ambient authority or fixture substitution."
    },
    {
      "id": "security-review",
      "intent": "Review a representative program for authority, protected release, recovery, and shutdown defects.",
      "acceptance": "No critical authority or release boundary is missed and every reported defect cites a source-visible boundary."
    },
    {
      "id": "sustained-service",
      "intent": "Operate the long-running service through repeated bounded work and orderly shutdown.",
      "acceptance": "The service remains bounded by declared quotas and settles all owned work during shutdown."
    }
  ],
  "applications": [
    {
      "id": "agent-enabled-service",
      "mode": "application",
      "intent": "Compose typed errors, artifacts, capabilities, live I/O, concurrency, source tools, protected release, and lifecycle."
    },
    {
      "id": "concurrent-tls-client",
      "mode": "application",
      "intent": "Exercise DNS, TLS, streaming I/O, cancellation, cleanup, and bounded concurrency."
    },
    {
      "id": "durable-agent-companion",
      "mode": "durable",
      "intent": "Reuse the portable agent library while proving transcript, tool-result, and resume recovery without live resources."
    },
    {
      "id": "filesystem-cli",
      "mode": "application",
      "intent": "Exercise explicit filesystem, environment, console, typed-error, and cleanup capabilities."
    },
    {
      "id": "http-service",
      "mode": "application",
      "intent": "Exercise listeners, streaming HTTP, mutable single-owner state, quotas, stop, and shutdown."
    },
    {
      "id": "parser-data-library",
      "mode": "portable",
      "intent": "Exercise pure packages, collections, iterators, closures, parsing, and typed errors."
    },
    {
      "id": "subprocess-build-tool",
      "mode": "application",
      "intent": "Exercise confined process launch, pipes, concurrent drain, cancellation, and reaping."
    }
  ],
  "matrix": {
    "launches": [
      "embedded",
      "standalone"
    ],
    "modes": [
      "application",
      "durable",
      "portable"
    ],
    "provider_evidence": [
      "deterministic-fake",
      "mocked-hook",
      "recorded-transcript"
    ],
    "failure_cuts": [
      "after-acceptance",
      "after-effect-before-commit",
      "after-result-commit",
      "before-admission",
      "during-cancellation",
      "during-cleanup"
    ]
  },
  "claim_blockers": [
    "general-purpose-profile",
    "production-execution-strategy",
    "stable-edition",
    "stable-standard-library"
  ],
  "material_change_reruns": [
    {
      "material_change": "api",
      "rerun": [
        "create",
        "debug",
        "modify",
        "security-review"
      ]
    },
    {
      "material_change": "diagnostics",
      "rerun": [
        "create",
        "debug",
        "modify"
      ]
    },
    {
      "material_change": "documentation",
      "rerun": [
        "create",
        "explain",
        "security-review"
      ]
    },
    {
      "material_change": "strategy",
      "rerun": [
        "cancellation",
        "create",
        "debug",
        "modify",
        "sustained-service"
      ]
    },
    {
      "material_change": "syntax",
      "rerun": [
        "create",
        "debug",
        "explain",
        "modify",
        "security-review"
      ]
    }
  ],
  "issues": [
    {
      "id": "GNT-GP-MODE-001",
      "normative_owner": "SPEC.md, frontend package contracts, analyzer applicability, executable IR, runtime recovery, facade, and launcher",
      "compatibility_owner": "SPEC.md, frontend package contracts, analyzer applicability, executable IR, runtime recovery, facade, and launcher",
      "evidence_owner": "SPEC.md, frontend package contracts, analyzer applicability, executable IR, runtime recovery, facade, and launcher",
      "publication_blocker": "general-purpose-profile",
      "rerun": [
        "create",
        "debug",
        "explain",
        "modify",
        "security-review"
      ],
      "depends_on": [
        "GNT-GP-GATE-000"
      ]
    },
    {
      "id": "GNT-GP-TYPE-001",
      "normative_owner": "gantry-analysis, gantry-ir, gantry-core, runtime recovery, schemas, and SPEC.md",
      "compatibility_owner": "gantry-analysis, gantry-ir, gantry-core, runtime recovery, schemas, and SPEC.md",
      "evidence_owner": "gantry-analysis, gantry-ir, gantry-core, runtime recovery, schemas, and SPEC.md",
      "publication_blocker": "general-purpose-profile",
      "rerun": [
        "create",
        "debug",
        "explain",
        "modify",
        "security-review"
      ],
      "depends_on": [
        "GNT-GP-MODE-001"
      ]
    },
    {
      "id": "GNT-GP-OWN-001",
      "normative_owner": "frontend, analyzer ownership, IR transfer instructions, runtime frames, operations, tasks, and SPEC.md",
      "compatibility_owner": "frontend, analyzer ownership, IR transfer instructions, runtime frames, operations, tasks, and SPEC.md",
      "evidence_owner": "frontend, analyzer ownership, IR transfer instructions, runtime frames, operations, tasks, and SPEC.md",
      "publication_blocker": "general-purpose-profile",
      "rerun": [
        "create",
        "debug",
        "explain",
        "modify",
        "security-review"
      ],
      "depends_on": [
        "GNT-GP-TYPE-001"
      ]
    },
    {
      "id": "GNT-GP-EFFECT-001",
      "normative_owner": "analyzer effects, IR signatures and operation inventories, linker, preflight, and SPEC.md",
      "compatibility_owner": "analyzer effects, IR signatures and operation inventories, linker, preflight, and SPEC.md",
      "evidence_owner": "analyzer effects, IR signatures and operation inventories, linker, preflight, and SPEC.md",
      "publication_blocker": "general-purpose-profile",
      "rerun": [
        "create",
        "debug",
        "explain",
        "modify",
        "security-review"
      ],
      "depends_on": [
        "GNT-GP-MODE-001",
        "GNT-GP-TYPE-001"
      ]
    },
    {
      "id": "GNT-GP-CAP-001",
      "normative_owner": "gantry-core, gantry-ir, gantry-host, runtime policy, durable rebinding, and SPEC.md",
      "compatibility_owner": "gantry-core, gantry-ir, gantry-host, runtime policy, durable rebinding, and SPEC.md",
      "evidence_owner": "gantry-core, gantry-ir, gantry-host, runtime policy, durable rebinding, and SPEC.md",
      "publication_blocker": "general-purpose-profile",
      "rerun": [
        "create",
        "debug",
        "explain",
        "modify",
        "security-review"
      ],
      "depends_on": [
        "GNT-GP-EFFECT-001",
        "GNT-GP-OWN-001"
      ]
    },
    {
      "id": "GNT-GP-PROTECT-001",
      "normative_owner": "protected core types, host ABI, policy, observation, runtime, and SPEC.md",
      "compatibility_owner": "protected core types, host ABI, policy, observation, runtime, and SPEC.md",
      "evidence_owner": "protected core types, host ABI, policy, observation, runtime, and SPEC.md",
      "publication_blocker": "general-purpose-profile",
      "rerun": [
        "create",
        "debug",
        "explain",
        "modify",
        "security-review"
      ],
      "depends_on": [
        "GNT-GP-CAP-001",
        "GNT-GP-TYPE-001"
      ]
    },
    {
      "id": "GNT-GP-AUTH-001",
      "normative_owner": "host policy/approval contracts, runtime state, durable evidence, protected audit, and SPEC.md",
      "compatibility_owner": "host policy/approval contracts, runtime state, durable evidence, protected audit, and SPEC.md",
      "evidence_owner": "host policy/approval contracts, runtime state, durable evidence, protected audit, and SPEC.md",
      "publication_blocker": "general-purpose-profile",
      "rerun": [
        "create",
        "debug",